{
  "artifacts": {
    "device_registry.v1.json": {
      "filename": "device_registry.v1.json",
      "sha256": "bc22f23beb1064c940c2fc72d443d692c0940ec7b677edc985bd7d62c6e25616"
    },
    "render_capabilities.v1.json": {
      "filename": "render_capabilities.v1.json",
      "sha256": "761be7eeb5d8b7250fba6b7751ede5ace1d6422b8e5ed13d104fdf33528aed42"
    },
    "render_manifest.v1.json": {
      "filename": "render_manifest.v1.json",
      "sha256": "6af1f7f0f0ba6242a25f581d3acac832f62dcda559d42f97a17463339faf0083"
    }
  },
  "contract": "spartina-device-render-catalog",
  "contract_version": 1,
  "generated_at": "2026-10-02T05:21:59Z",
  "renderer_version": "1.0.0",
  "wallmock_commit": "c9ed7fee00573d49a1a8f6466d0a0919d7db46d2",
  "working_tree_dirty": false
}
